domain,url,status,title,h1,h2_headings,file_status,topic_cluster,cluster_score,interim_triage,redirect_to_url
nakanodent.com,https://nakanodent.com/blog/archives/6388/,200,時計好きの歯医者 岡山なかの歯科・矯正歯科クリニック,岡山なかの歯科・矯正歯科クリニック @@日本の政府役員の方々これからの日本と日本円の価値を宜しくお願いします。@@本当に宜しくお願い致します。,,正常,C01_マウスピース矯正・基礎理解,0.2703,維持・部分更新,
nakanodent.com,https://nakanodent.com/blog/archives/7449/,200,オールオン４　ザイゴマインプラント　メルボルンセミナーその２ 岡山なかの歯科・矯正歯科クリニック,岡山なかの歯科・矯正歯科クリニック @@海外の歯科医師は日本の歯科医師と比較してスーパーリッチリッチである,,正常,C09_インプラント・全顎・オールオン4,0.492,維持・部分更新,
nakanodent.com,https://nakanodent.com/blog/archives/7845/,200,岡山でインプラント治療 そのメリット・デメリット 岡山なかの歯科・矯正歯科クリニック,岡山なかの歯科・矯正歯科クリニック,,正常,C07_インプラント・基礎理解,0.4889,維持・部分更新,
nakanodent.com,https://nakanodent.com/blog/archives/7174/,200,あなたは自分の歯が何本あるかご存じですか？ 岡山なかの歯科・矯正歯科クリニック,岡山なかの歯科・矯正歯科クリニック,,正常,C07_インプラント・基礎理解,0.5045,維持・部分更新,
nakanodent.com,https://nakanodent.com/blog/archives/7277/,200,私が歯科医師として「正しい歯科医院の選び方」をお伝えします。 岡山なかの歯科・矯正歯科クリニック,岡山なかの歯科・矯正歯科クリニック,,正常,C34_院長・医師プロフィール,0.3134,維持・部分更新,
nakanodent.com,https://nakanodent.com/blog/archives/7073/,200,マウスピース矯正「インビザライン」と費用について、インビザラインドクターが解説します。 岡山なかの歯科・矯正歯科クリニック,岡山なかの歯科・矯正歯科クリニック,,正常,C01_マウスピース矯正・基礎理解,0.5382,維持・部分更新,
nakanodent.com,https://nakanodent.com/blog/archives/7124/,200,インビザラインとワイヤー矯正：その違いとは？ 岡山なかの歯科・矯正歯科クリニック,岡山なかの歯科・矯正歯科クリニック,,正常,C07_インプラント・基礎理解,0.4866,維持・部分更新,
nakanodent.com,https://nakanodent.com/blog/archives/7190/,200,3分でわかる歯周病にならない方法 岡山なかの歯科・矯正歯科クリニック,岡山なかの歯科・矯正歯科クリニック,,正常,C26_自費メンテナンス・予防,0.3959,維持・部分更新,
nakanodent.com,https://nakanodent.com/blog/archives/7039/,200,60歳の私のトリセツ 岡山なかの歯科・矯正歯科クリニック,岡山なかの歯科・矯正歯科クリニック @@ほとんどは、私が妻が外で誘拐とか、誰かに犯罪等の被害を受けていないかという心配からするのであるが、どうも妻には伝わらない。@@決して私が妻に、かまって欲しいからではない！,"妻が珍しい辛子色の服を着ていた。, 夫：「その服、いつ買った？初めて見るわ！」, 妻：「もう何度も来ていますけど！」, 夫：「えっ！今から、どこか行く？」, 妻：「どこだって、いいでしょ！」, 夫：「ママ、今どこ？」, LINEや電話に出ない！, 夫：「ママ、何時に帰ってくる？」, 妻：「わからない！」",正常,C01_マウスピース矯正・基礎理解,0.4378,維持・部分更新,
nakanodent.com,https://nakanodent.com/blog/archives/7605/,200,入れ歯をすぐに取り出せる「入れ歯銀行」 岡山なかの歯科・矯正歯科クリニック,岡山なかの歯科・矯正歯科クリニック,,正常,C37_設備・技術・デジタル歯科,0.4187,維持・部分更新,
nakanodent.com,https://nakanodent.com/blog/archives/6313/,200,歯医者でのセカンドオピニオン 岡山なかの歯科・矯正歯科クリニック,岡山なかの歯科・矯正歯科クリニック,,正常,C41_カウンセリング・初診・無料相談,0.4184,維持・部分更新,
nakanodent.com,https://nakanodent.com/blog/archives/7840/,200,岡山の歯医者の私がオールオン４に関する書籍を出版します。 岡山なかの歯科・矯正歯科クリニック,岡山なかの歯科・矯正歯科クリニック,,正常,C19_ホワイトニング・基礎と方式,0.4434,維持・部分更新,
nakanodent.com,https://nakanodent.com/blog/archives/6779/,200,オールオン４ザイゴマインプラント協会 岡山なかの歯科・矯正歯科クリニック,岡山なかの歯科・矯正歯科クリニック,,正常,C09_インプラント・全顎・オールオン4,0.4746,維持・部分更新,
nakanodent.com,https://nakanodent.com/blog/archives/8103/,200,オールオンフォー　ザイゴマインプラントの編集で岡山の歯医者がメルボルンへ！ 岡山なかの歯科・矯正歯科クリニック,岡山なかの歯科・矯正歯科クリニック,,正常,C09_インプラント・全顎・オールオン4,0.4598,維持・部分更新,
nakanodent.com,https://nakanodent.com/blog/archives/7060/,200,オールオン4治療の費用はいくら？保険適用にはなるのか？ 岡山なかの歯科・矯正歯科クリニック,岡山なかの歯科・矯正歯科クリニック,,正常,C07_インプラント・基礎理解,0.4905,維持・部分更新,
nakanodent.com,https://nakanodent.com/blog/archives/7696/,200,マウスピース矯正　インビザライン　ジャパンフォーラム　その１ 岡山なかの歯科・矯正歯科クリニック,岡山なかの歯科・矯正歯科クリニック @@今から思えばその二人は大学の同級生夫婦では無いと言われていたが深夜の12時に二人で飲みに来るとは？@@私はお邪魔でしたよね！@@大変申し訳ありませんでした！！,,正常,C01_マウスピース矯正・基礎理解,0.5012,維持・部分更新,
nakanodent.com,https://nakanodent.com/blog/archives/8471/,200,【注意喚起】セルフホワイトニングのトラブルが急増中！岡山の歯科医が警鐘を鳴らします 岡山なかの歯科・矯正歯科クリニック,岡山なかの歯科・矯正歯科クリニック @@【注意喚起】セルフホワイトニングのトラブルが急増中！岡山の歯科医が警鐘を鳴らします,"▶ セルフホワイトニングとは？, ▶ セルフホワイトニングで実際にあったトラブル, ▶ なぜセルフホワイトニングで問題が起きるのか？, ▶ 歯科医院でのホワイトニングのメリット, ▶ セルフホワイトニングを検討中の方へ, ▶ まとめ｜ホワイトニングは歯科医院で安全・安心に, 📍岡山でホワイトニングをお考えなら",正常,C19_ホワイトニング・基礎と方式,0.5305,維持・部分更新,
nakanodent.com,https://nakanodent.com/blog/archives/8724/,200,登坂、下り坂、ま坂 岡山なかの歯科・矯正歯科クリニック,岡山なかの歯科・矯正歯科クリニック @@でもね、私は決してあきらめない！！@@100年継続する歯科医院を作るために@@決してあきらめない！！！@@,,正常,C10_インプラント・リスクと医院選び,0.4458,維持・部分更新,
nakanodent.com,https://nakanodent.com/blog/archives/7526/,200,誰もが嫌なお口の匂い　口臭の原因と歯科治療 岡山なかの歯科・矯正歯科クリニック,岡山なかの歯科・矯正歯科クリニック,,正常,C26_自費メンテナンス・予防,0.4225,維持・部分更新,
nakanodent.com,https://nakanodent.com/blog/archives/7670/,200,日本糖尿病協会登録歯科医院 岡山なかの歯科・矯正歯科クリニック,岡山なかの歯科・矯正歯科クリニック,,正常,C28_歯周病治療と再生療法,0.4174,維持・部分更新,
nakanodent.com,https://nakanodent.com/blog/archives/7662/,200,今年26回目のオールオン４（オールオンフォー）のオペ 岡山なかの歯科・矯正歯科クリニック,岡山なかの歯科・矯正歯科クリニック @@負けた！！,,正常,C09_インプラント・全顎・オールオン4,0.4539,維持・部分更新,
nakanodent.com,https://nakanodent.com/blog/archives/7186/,200,11月8日は「いい歯の日」 岡山なかの歯科・矯正歯科クリニック,岡山なかの歯科・矯正歯科クリニック,,正常,C02_マウスピース矯正・ブランド比較,0.2117,維持・部分更新,
nakanodent.com,https://nakanodent.com/blog/archives/8403/,200,【今年30回目のオールオンフォー手術】静脈内鎮静法で患者さんも安心のインプラント治療｜岡山の歯科ブログ 岡山なかの歯科・矯正歯科クリニック,岡山なかの歯科・矯正歯科クリニック,【今年30回目のオールオンフォー手術】静脈内鎮静法で患者さんも安心のインプラント治療｜岡山の歯科ブログ,正常,C41_カウンセリング・初診・無料相談,0.4913,維持・部分更新,
nakanodent.com,https://nakanodent.com/blog/archives/7444/,200,オールオン４　ザイゴマインプラントセミナ－　メルボルンその１ 岡山なかの歯科・矯正歯科クリニック,岡山なかの歯科・矯正歯科クリニック @@頼んだ火鍋は辛くて辛くて私の体は上からも下からも火を吐いた。,,正常,C09_インプラント・全顎・オールオン4,0.4999,維持・部分更新,
nakanodent.com,https://nakanodent.com/blog/archives/7193/,200,3分でわかるオールオン4のメリットとデメリット 岡山なかの歯科・矯正歯科クリニック,岡山なかの歯科・矯正歯科クリニック,,正常,C01_マウスピース矯正・基礎理解,0.5326,維持・部分更新,
nakanodent.com,https://nakanodent.com/blog/archives/8237/,200,金持ち歯医者さん vs 貧乏歯医者さん 〜成功する歯科医院の秘訣〜 岡山なかの歯科・矯正歯科クリニック,岡山なかの歯科・矯正歯科クリニック,,正常,C39_患者の声・口コミ,0.3554,維持・部分更新,
nakanodent.com,https://nakanodent.com/blog/archives/7992/,200,12月にグレーター・ニューヨーク歯科会議に参加するためニューヨークに行ってきました 岡山なかの歯科・矯正歯科クリニック,岡山なかの歯科・矯正歯科クリニック,,正常,C19_ホワイトニング・基礎と方式,0.4849,維持・部分更新,
nakanodent.com,https://nakanodent.com/blog/archives/8029/,200,岡山市の歯医者の事前準備の進め方 岡山なかの歯科・矯正歯科クリニック,岡山なかの歯科・矯正歯科クリニック,,正常,C09_インプラント・全顎・オールオン4,0.4614,維持・部分更新,
nakanodent.com,https://nakanodent.com/blog/archives/7121/,200,喫煙していてもインプラントは受けられる？「インプラント」と「喫煙」の関係性について 岡山なかの歯科・矯正歯科クリニック,岡山なかの歯科・矯正歯科クリニック,,正常,C07_インプラント・基礎理解,0.4886,維持・部分更新,
nakanodent.com,https://nakanodent.com/blog/archives/6386/,200,バンコクから成田へ 岡山なかの歯科・矯正歯科クリニック,岡山なかの歯科・矯正歯科クリニック,,正常,C05_マウスピース矯正・大人の矯正,0.2165,維持・部分更新,
nakanodent.com,https://nakanodent.com/blog/archives/7949/,200,サンパウロでオールオンフォー　ザイゴマインプラント研修　その５ 岡山なかの歯科・矯正歯科クリニック,岡山なかの歯科・矯正歯科クリニック,,正常,C09_インプラント・全顎・オールオン4,0.4429,維持・部分更新,
nakanodent.com,https://nakanodent.com/blog/archives/7905/,200,北海道　医院旅行　その３ 岡山なかの歯科・矯正歯科クリニック,岡山なかの歯科・矯正歯科クリニック @@「本日２名で入ることが出来る時間はありますでしょうか？」@@「申し訳ありません、本日はイベントがあるためにこれ以上のお客様の来店は全てお断りしています！」@@エッ！ 無理？？ オーマイガーッ！！！,,正常,C34_院長・医師プロフィール,0.3011,維持・部分更新,
nakanodent.com,https://nakanodent.com/blog/archives/7913/,200,北海道旅行　その４ 岡山なかの歯科・矯正歯科クリニック,岡山なかの歯科・矯正歯科クリニック @@ごめんなさい！院長の私の日ごろの行いが悪いから雨が降ったんです。@@このお店の年間パスがあれば本気で買おうかと悩むニュ－ハーフ好きの院長だった。,お勘定はいくらになるの？,正常,C10_インプラント・リスクと医院選び,0.4371,維持・部分更新,
nakanodent.com,https://nakanodent.com/blog/archives/7068/,200,現在のインプラント、未来のインプラント 岡山なかの歯科・矯正歯科クリニック,岡山なかの歯科・矯正歯科クリニック,,正常,C07_インプラント・基礎理解,0.4824,維持・部分更新,
nakanodent.com,https://nakanodent.com/blog/archives/6435/,200,歯のホワイトニングキャンペーン 岡山なかの歯科・矯正歯科クリニック,岡山なかの歯科・矯正歯科クリニック,,正常,C19_ホワイトニング・基礎と方式,0.5098,維持・部分更新,
nakanodent.com,https://nakanodent.com/blog/archives/7376/,200,食後の爪楊枝でいつも出血します、歯医者さんに行った方が良いでしょうか？ 岡山なかの歯科・矯正歯科クリニック,岡山なかの歯科・矯正歯科クリニック,,正常,C28_歯周病治療と再生療法,0.3857,維持・部分更新,
nakanodent.com,https://nakanodent.com/blog/archives/6361/,200,そしてローマその１ 岡山なかの歯科・矯正歯科クリニック,岡山なかの歯科・矯正歯科クリニック,,正常,C42_医院の取り組み・理念・特色,0.276,維持・部分更新,
nakanodent.com,https://nakanodent.com/blog/archives/7389/,200,今年初めてのオールオン４（インプラント）のオペが無事に終わりました。 岡山なかの歯科・矯正歯科クリニック,岡山なかの歯科・矯正歯科クリニック,,正常,C09_インプラント・全顎・オールオン4,0.5235,維持・部分更新,
nakanodent.com,https://nakanodent.com/blog/archives/7704/,200,歌舞伎町のホテル 岡山なかの歯科・矯正歯科クリニック,岡山なかの歯科・矯正歯科クリニック @@ここは法治国家の日本だよね。@@歌舞伎町はホテルの外もホテルの中も怖かった。,,正常,C09_インプラント・全顎・オールオン4,0.4427,維持・部分更新,
nakanodent.com,https://nakanodent.com/blog/archives/8097/,200,オールオンフォー　ザイゴマインプラントセミナー　その４？　岡山の歯医者 岡山なかの歯科・矯正歯科クリニック,岡山なかの歯科・矯正歯科クリニック,,正常,C09_インプラント・全顎・オールオン4,0.4435,維持・部分更新,
nakanodent.com,https://nakanodent.com/blog/archives/7063/,200,なぜ人間は歯を失うとまずいのか？  インプラント、入れ歯、ブリッジ 岡山なかの歯科・矯正歯科クリニック,岡山なかの歯科・矯正歯科クリニック @@プリンちゃんは動物病院で、怖くて、痛くて、悲しくて涙を流したと思います。@@プリンちゃんの歯科医療費は保険は適応されず全ては自由診療ですから、私はその後請求書を見て高くて、怖くて、悲しくて涙を流しました。@@人間も歯を失うと大変です。@@人間ならインプラントや、矯正やセラミック治療を希望されなければ、保険での治療も可能です。@@もし歯科医院に行くのを放置しているのらここで決意して明日の朝にでも歯科医院に予約を取る電話をかけて下さい。,,正常,C07_インプラント・基礎理解,0.4961,維持・部分更新,
nakanodent.com,https://nakanodent.com/blog/archives/8720/,200,カムログインプラント日本発売25周年を迎えて 岡山なかの歯科・矯正歯科クリニック,岡山なかの歯科・矯正歯科クリニック,,正常,C07_インプラント・基礎理解,0.421,維持・部分更新,
nakanodent.com,https://nakanodent.com/blog/archives/8398/,200,【27回目のオールオンフォー】上下28本抜歯・インプラント埋入手術を行いました｜岡山の歯医者ブログ 岡山なかの歯科・矯正歯科クリニック,岡山なかの歯科・矯正歯科クリニック @@【27回目のオールオンフォー】上下28本抜歯・インプラント埋入手術を行いました｜岡山の歯医者ブログ,"◆ オールオンフォー（All-on-4）とは？, ◆ 28本の抜歯＋インプラント埋入を同時に行う意味, ◆ 静脈内鎮静法で“眠っている間に”手術が終わる, ◆ 岡山でオールオンフォーをご検討の方へ, ◆ 最後に｜「入れ歯で悩む人生」からの卒業を",正常,C07_インプラント・基礎理解,0.4624,維持・部分更新,
nakanodent.com,https://nakanodent.com/blog/archives/7529/,200,口ゴボ（上下顎前突）の矯正治療 岡山なかの歯科・矯正歯科クリニック,岡山なかの歯科・矯正歯科クリニック,,正常,C16_ワイヤー矯正・基礎と装置選択,0.4435,維持・部分更新,
nakanodent.com,https://nakanodent.com/blog/archives/7660/,200,日本オールオンフォー・ザイゴマインプラント協会で ゲスト講師として発表して来ました。 岡山なかの歯科・矯正歯科クリニック,岡山なかの歯科・矯正歯科クリニック @@どうやらゲスト講師の私の到着を皆さん20分も待たれていたらしい。@@大丈夫！明日の講演を頑張れば今日の20分は挽回できる！！@@大丈夫、きっと大丈夫！！！,,正常,C09_インプラント・全顎・オールオン4,0.4424,維持・部分更新,
nakanodent.com,https://nakanodent.com/blog/archives/7037/,200,オールオン4治療に関する質問 岡山なかの歯科・矯正歯科クリニック,岡山なかの歯科・矯正歯科クリニック @@オールオン４を検討されているあなた、宜しければインプラント無料相談でも結構ですから一度お越しになりませんか？,,正常,C09_インプラント・全顎・オールオン4,0.4789,維持・部分更新,
nakanodent.com,https://nakanodent.com/blog/archives/7264/,200,ニューヨークの物価は高い 岡山なかの歯科・矯正歯科クリニック,岡山なかの歯科・矯正歯科クリニック,これで1泊8万円、日本のビジネスホテルの,正常,C08_インプラント・術式と材料選択,0.2853,維持・部分更新,
nakanodent.com,https://nakanodent.com/blog/archives/6773/,200,インプラントは何年もちますか？ 岡山なかの歯科・矯正歯科クリニック,岡山なかの歯科・矯正歯科クリニック,,正常,C11_インプラント・治療後とメンテナンス,0.4304,維持・部分更新,
nakanodent.com,https://nakanodent.com/blog/archives/6306/,200,悩みは深い！RSKテレビ出演！！ 岡山なかの歯科・矯正歯科クリニック,岡山なかの歯科・矯正歯科クリニック @@しかし、これはもしかして私の後釜の先生か？@@私は首になるのか？@@悩む！！本当に悩む！！！,,正常,C28_歯周病治療と再生療法,0.2893,維持・部分更新,
nakanodent.com,https://nakanodent.com/blog/archives/7272/,200,Greater NYC Dental Conference 岡山なかの歯科・矯正歯科クリニック,岡山なかの歯科・矯正歯科クリニック,,正常,C26_自費メンテナンス・予防,0.3875,維持・部分更新,
nakanodent.com,https://nakanodent.com/blog/archives/7147/,200,抜歯後の痛み　ドライソケットについて 岡山なかの歯科・矯正歯科クリニック,岡山なかの歯科・矯正歯科クリニック,,正常,C18_矯正方法の比較検討,0.3054,維持・部分更新,
nakanodent.com,https://nakanodent.com/blog/archives/7016/,200,インプラント治療を後悔しないための重要なポイント 岡山なかの歯科・矯正歯科クリニック,岡山なかの歯科・矯正歯科クリニック,,正常,C07_インプラント・基礎理解,0.4566,維持・部分更新,
nakanodent.com,https://nakanodent.com/blog/archives/8716/,200,インプラント治療についての岡山市の方からの質問 岡山なかの歯科・矯正歯科クリニック,岡山なかの歯科・矯正歯科クリニック,,正常,C07_インプラント・基礎理解,0.4604,維持・部分更新,
nakanodent.com,https://nakanodent.com/blog/archives/7657/,200,オールオンフォー（オールオン4）インプラント治療のメリットとデメリット 岡山なかの歯科・矯正歯科クリニック,岡山なかの歯科・矯正歯科クリニック,,正常,C09_インプラント・全顎・オールオン4,0.516,維持・部分更新,
nakanodent.com,https://nakanodent.com/blog/archives/6846/,200,院長、黒帯取ったってよ！ 岡山なかの歯科・矯正歯科クリニック,岡山なかの歯科・矯正歯科クリニック @@しかし、昇段試験で右肩を痛めた私は今日の練習後に、知り合いの整形外科を受診したことは内緒にして下さい。,,正常,C34_院長・医師プロフィール,0.289,維持・部分更新,
nakanodent.com,https://nakanodent.com/blog/archives/8393/,200,【62歳の挑戦】なぜ今も学び続けるのか？岡山の歯科医師としての私の想い 岡山なかの歯科・矯正歯科クリニック,岡山なかの歯科・矯正歯科クリニック @@【62歳の挑戦】なぜ今も学び続けるのか？岡山の歯科医師としての私の想い｜岡山なかの歯科・矯正歯科クリニック 院長ブログ,"◆ 医療は日進月歩。止まった瞬間に“過去の医療”になる, ◆ 最新治療を“岡山で受けられる”意味, ◆ 年齢を重ねた今だからこそ感じる「成長の必要性」, ◆ 患者さまの「信頼」を裏切らないために, ◆ 最後に｜岡山の皆さまへ",正常,C09_インプラント・全顎・オールオン4,0.4578,維持・部分更新,
nakanodent.com,https://nakanodent.com/blog/archives/7541/,200,「お口ポカン」、口唇閉鎖不全症とは？ 岡山なかの歯科・矯正歯科クリニック,岡山なかの歯科・矯正歯科クリニック,,正常,C02_マウスピース矯正・ブランド比較,0.2331,維持・部分更新,
nakanodent.com,https://nakanodent.com/blog/archives/7350/,200,「妊娠中でも歯の治療はできますか？」 岡山なかの歯科・矯正歯科クリニック,岡山なかの歯科・矯正歯科クリニック,,正常,C27_一般歯科・虫歯と痛み,0.3991,維持・部分更新,
nakanodent.com,https://nakanodent.com/blog/archives/7708/,200,安藤歯科でのオールオンフォー、ザイゴマインプラント　プライベートセミナー 岡山なかの歯科・矯正歯科クリニック,岡山なかの歯科・矯正歯科クリニック @@しかし、そこまで褒められるとKAVOのCTがドンドンと欲しくなる私@@歯科用CTって、1500万円から2000万円は普通にする。@@じっと手を見る！！,,正常,C09_インプラント・全顎・オールオン4,0.4914,維持・部分更新,
nakanodent.com,https://nakanodent.com/blog/archives/7106/,200,「女性が輝くため」のセミナー 岡山なかの歯科・矯正歯科クリニック,岡山なかの歯科・矯正歯科クリニック @@「すみません、こんなことを言うと驚かれるかもしれませんがすぐに私の脳裏に浮かんだ言葉は、浮かんだ言葉は。。@@ @@ @@ @@ @@ @@ @@ @@「女装（じょそう）です！！」@@「女装ですか？いいじゃないですか！！」笑！笑！！笑！！！@@安全、安心でポジティブな場所はどこにもない！,,正常,C42_医院の取り組み・理念・特色,0.2694,維持・部分更新,
nakanodent.com,https://nakanodent.com/blog/archives/8095/,200,オールオンフォー　ザイゴマインプラント研修　その３　岡山の歯医者が 岡山なかの歯科・矯正歯科クリニック,岡山なかの歯科・矯正歯科クリニック,,正常,C09_インプラント・全顎・オールオン4,0.4429,維持・部分更新,
nakanodent.com,https://nakanodent.com/blog/archives/6354/,200,そしてローマ その２ 岡山なかの歯科・矯正歯科クリニック,岡山なかの歯科・矯正歯科クリニック,,正常,C02_マウスピース矯正・ブランド比較,0.262,維持・部分更新,
nakanodent.com,https://nakanodent.com/blog/archives/8032/,200,タイの歯科医院、ベトナムの歯科医院 岡山なかの歯科・矯正歯科クリニック,岡山なかの歯科・矯正歯科クリニック,,正常,C42_医院の取り組み・理念・特色,0.2674,維持・部分更新,
