domain,url,status,title,h1,h2_headings,file_status,topic_cluster,cluster_score,interim_triage,redirect_to_url
nakanodent.com,https://nakanodent.com/faq-portal/2025/11/24/%e6%ad%af%e3%81%8e%e3%81%97%e3%82%8a%e3%81%ae%e5%af%be%e7%ad%96%e3%81%af%e3%81%82%e3%82%8a%e3%81%be%e3%81%99%e3%81%8b%ef%bc%9f/,200,歯ぎしりの対策はありますか？ 岡山なかの歯科・矯正歯科クリニック歯の知恵袋Q&A,岡山なかの歯科・矯正歯科クリニック,,正常,C31_顎関節症・歯ぎしり・睡眠時無呼吸,0.3417,維持・部分更新,
nakanodent.com,https://nakanodent.com/faq-portal/2025/11/24/%e5%a6%8a%e5%a8%a0%e4%b8%ad%e3%81%a7%e3%82%82%e6%ad%af%e7%a7%91%e6%b2%bb%e7%99%82%e3%82%92%e5%8f%97%e3%81%91%e3%82%89%e3%82%8c%e3%81%be%e3%81%99%e3%81%8b%ef%bc%9f/,200,妊娠中でも歯科治療を受けられますか？ 岡山なかの歯科・矯正歯科クリニック歯の知恵袋Q&A,岡山なかの歯科・矯正歯科クリニック,,正常,C32_訪問歯科・高齢者歯科,0.218,維持・部分更新,
nakanodent.com,https://nakanodent.com/faq-portal/2025/11/24/%e7%9f%af%e6%ad%a3%e6%b2%bb%e7%99%82%e5%be%8c%e3%81%ae%e3%83%aa%e3%83%86%e3%83%bc%e3%83%8a%e3%83%bc%ef%bc%88%e4%bf%9d%e5%ae%9a%e8%a3%85%e7%bd%ae%ef%bc%89%e3%81%af%e3%81%9a%e3%81%a3%e3%81%a8%e3%81%a4/,200,矯正治療後のリテーナー（保定装置）はずっとつけるのですか？ 岡山なかの歯科・矯正歯科クリニック歯の知恵袋Q&A,岡山なかの歯科・矯正歯科クリニック,,正常,C06_マウスピース矯正・治療後とメンテナンス,0.355,維持・部分更新,
nakanodent.com,https://nakanodent.com/faq-portal/2025/11/24/%e6%ad%af%e7%a7%91%e5%8c%bb%e9%99%a2%e3%81%a7%e3%81%ae%e3%82%af%e3%83%aa%e3%83%bc%e3%83%8b%e3%83%b3%e3%82%b0%e3%81%ae%e9%a0%bb%e5%ba%a6%e3%81%af%e3%81%a9%e3%82%8c%e3%81%8f%e3%82%89%e3%81%84%e3%81%8c/,200,歯科医院でのクリーニングの頻度はどれくらいがいいですか？ 岡山なかの歯科・矯正歯科クリニック歯の知恵袋Q&A,岡山なかの歯科・矯正歯科クリニック,,正常,C26_自費メンテナンス・予防,0.412,維持・部分更新,
nakanodent.com,https://nakanodent.com/faq-portal/2025/11/24/%e9%9b%bb%e5%8b%95%e6%ad%af%e3%83%96%e3%83%a9%e3%82%b7%e3%81%af%e5%8a%b9%e6%9e%9c%e7%9a%84%e3%81%a7%e3%81%99%e3%81%8b%ef%bc%9f/,200,電動歯ブラシは効果的ですか？ 岡山なかの歯科・矯正歯科クリニック歯の知恵袋Q&A,岡山なかの歯科・矯正歯科クリニック,,正常,C40_地域・アクセス・診療時間,0.1753,維持・部分更新,
nakanodent.com,https://nakanodent.com/faq-portal/2025/11/24/%e6%ad%af%e8%8c%8e%e3%81%8b%e3%82%89%e3%81%ae%e5%87%ba%e8%a1%80%e3%81%af%e5%95%8f%e9%a1%8c%e3%81%82%e3%82%8a%e3%81%be%e3%81%99%e3%81%8b%ef%bc%9f/,200,歯茎からの出血は問題ありますか？ 岡山なかの歯科・矯正歯科クリニック歯の知恵袋Q&A,岡山なかの歯科・矯正歯科クリニック,,正常,C33_主訴・症状起点,0.1889,維持・部分更新,
nakanodent.com,https://nakanodent.com/faq-portal/2025/11/24/%e6%ad%af%e7%a7%91%e6%b2%bb%e7%99%82%e4%b8%ad%e3%81%ab%e7%97%9b%e3%81%bf%e3%82%92%e6%84%9f%e3%81%98%e3%81%9f%e3%82%89%e3%81%a9%e3%81%86%e3%81%99%e3%82%8c%e3%81%b0%e3%81%84%e3%81%84%e3%81%a7%e3%81%99/,200,歯科治療中に痛みを感じたらどうすればいいですか？ 岡山なかの歯科・矯正歯科クリニック歯の知恵袋Q&A,岡山なかの歯科・矯正歯科クリニック,,正常,C32_訪問歯科・高齢者歯科,0.2073,維持・部分更新,
nakanodent.com,https://nakanodent.com/faq-portal/2025/11/24/%e6%ad%af%e3%81%ae%e7%9d%80%e8%89%b2%e3%81%af%e3%81%a9%e3%81%86%e3%81%99%e3%82%8c%e3%81%b0%e5%8f%96%e3%82%8c%e3%81%be%e3%81%99%e3%81%8b%ef%bc%9f/,200,歯の着色はどうすれば取れますか？ 岡山なかの歯科・矯正歯科クリニック歯の知恵袋Q&A,岡山なかの歯科・矯正歯科クリニック,,正常,C40_地域・アクセス・診療時間,0.1753,維持・部分更新,
nakanodent.com,https://nakanodent.com/faq-portal/2025/11/24/%e4%bf%9d%e9%99%ba%e8%a8%ba%e7%99%82%e3%81%a8%e8%87%aa%e8%b2%bb%e8%a8%ba%e7%99%82%e3%81%ae%e9%81%95%e3%81%84%e3%81%af%e4%bd%95%e3%81%a7%e3%81%99%e3%81%8b%ef%bc%9f/,200,保険診療と自費診療の違いは何ですか？ 岡山なかの歯科・矯正歯科クリニック歯の知恵袋Q&A,岡山なかの歯科・矯正歯科クリニック,,正常,C26_自費メンテナンス・予防,0.2016,維持・部分更新,
nakanodent.com,https://nakanodent.com/faq-portal/2025/11/24/%e6%ad%af%e7%a7%91%e6%b2%bb%e7%99%82%e3%81%ae%e9%ba%bb%e9%85%94%e3%81%af%e5%8d%b1%e9%99%ba%e3%81%a7%e3%81%99%e3%81%8b%ef%bc%9f/,200,歯科治療の麻酔は危険ですか？ 岡山なかの歯科・矯正歯科クリニック歯の知恵袋Q&A,岡山なかの歯科・矯正歯科クリニック,,正常,C38_安全性・滅菌・感染対策,0.2092,維持・部分更新,
nakanodent.com,https://nakanodent.com/faq-portal/2025/11/24/%e6%ad%af%e5%8c%bb%e8%80%85%e9%81%b8%e3%81%b3%e3%81%ae%e3%83%9d%e3%82%a4%e3%83%b3%e3%83%88%e3%81%af%e4%bd%95%e3%81%a7%e3%81%99%e3%81%8b%ef%bc%9f/,200,歯医者選びのポイントは何ですか？ 岡山なかの歯科・矯正歯科クリニック歯の知恵袋Q&A,岡山なかの歯科・矯正歯科クリニック,,正常,C40_地域・アクセス・診療時間,0.1757,維持・部分更新,
nakanodent.com,https://nakanodent.com/faq-portal/2025/11/24/%e6%ad%af%e7%a7%91%e6%b2%bb%e7%99%82%e3%81%af%e5%a6%8a%e5%a8%a0%e5%89%8d%e3%81%ab%e6%b8%88%e3%81%be%e3%81%9b%e3%82%8b%e3%81%b9%e3%81%8d%e3%81%a7%e3%81%99%e3%81%8b%ef%bc%9f/,200,歯科治療は妊娠前に済ませるべきですか？ 岡山なかの歯科・矯正歯科クリニック歯の知恵袋Q&A,岡山なかの歯科・矯正歯科クリニック,,正常,C32_訪問歯科・高齢者歯科,0.2146,維持・部分更新,
nakanodent.com,https://nakanodent.com/faq-portal/2025/11/24/%e7%9f%af%e6%ad%a3%e6%b2%bb%e7%99%82%e3%81%a7%e6%ad%af%e3%82%92%e6%8a%9c%e3%81%8f%e3%81%93%e3%81%a8%e3%81%8c%e3%81%82%e3%82%8b%e3%81%ae%e3%81%af%e3%81%aa%e3%81%9c%e3%81%a7%e3%81%99%e3%81%8b%ef%bc%9f/,200,矯正治療で歯を抜くことがあるのはなぜですか？ 岡山なかの歯科・矯正歯科クリニック歯の知恵袋Q&A,岡山なかの歯科・矯正歯科クリニック,,正常,C40_地域・アクセス・診療時間,0.1851,維持・部分更新,
nakanodent.com,https://nakanodent.com/faq-portal/2025/11/24/%e8%99%ab%e6%ad%af%e3%81%ae%e8%a9%b0%e3%82%81%e7%89%a9%e3%82%84%e8%a2%ab%e3%81%9b%e7%89%a9%e3%81%ae%e5%af%bf%e5%91%bd%e3%81%af%e3%81%a9%e3%82%8c%e3%81%8f%e3%82%89%e3%81%84%e3%81%a7%e3%81%99%e3%81%8b/,200,虫歯の詰め物や被せ物の寿命はどれくらいですか？ 岡山なかの歯科・矯正歯科クリニック歯の知恵袋Q&A,岡山なかの歯科・矯正歯科クリニック,,正常,C27_一般歯科・虫歯と痛み,0.3008,維持・部分更新,
nakanodent.com,https://nakanodent.com/faq-portal/2025/11/24/%e6%ad%af%e3%81%ae%e3%81%99%e3%81%8d%e9%96%93%e3%82%92%e5%9f%8b%e3%82%81%e3%82%8b%e6%96%b9%e6%b3%95%e3%81%af%e3%81%82%e3%82%8a%e3%81%be%e3%81%99%e3%81%8b%ef%bc%9f/,200,歯のすき間を埋める方法はありますか？ 岡山なかの歯科・矯正歯科クリニック歯の知恵袋Q&A,岡山なかの歯科・矯正歯科クリニック,,正常,C40_地域・アクセス・診療時間,0.1755,維持・部分更新,
nakanodent.com,https://nakanodent.com/faq-portal/2025/11/24/%e9%8a%80%e6%ad%af%e3%82%92%e3%82%bb%e3%83%a9%e3%83%9f%e3%83%83%e3%82%af%e3%81%ab%e5%a4%89%e3%81%88%e3%82%8b%e3%83%a1%e3%83%aa%e3%83%83%e3%83%88%e3%81%af%e4%bd%95%e3%81%a7%e3%81%99%e3%81%8b%ef%bc%9f/,200,銀歯をセラミックに変えるメリットは何ですか？ 岡山なかの歯科・矯正歯科クリニック歯の知恵袋Q&A,岡山なかの歯科・矯正歯科クリニック,,正常,C21_セラミック治療・基礎と適応,0.4162,維持・部分更新,
nakanodent.com,https://nakanodent.com/faq-portal/2025/11/24/%e5%ad%90%e4%be%9b%e3%81%ae%e6%8c%87%e3%81%97%e3%82%83%e3%81%b6%e3%82%8a%e3%81%af%e6%ad%af%e4%b8%a6%e3%81%b3%e3%81%ab%e5%bd%b1%e9%9f%bf%e3%81%97%e3%81%be%e3%81%99%e3%81%8b%ef%bc%9f/,200,子供の指しゃぶりは歯並びに影響しますか？ 岡山なかの歯科・矯正歯科クリニック歯の知恵袋Q&A,岡山なかの歯科・矯正歯科クリニック,,正常,C12_小児矯正・基礎と適齢期,0.3057,維持・部分更新,
nakanodent.com,https://nakanodent.com/faq-portal/2025/11/24/%e6%ad%af%e3%81%ae%e3%82%af%e3%83%aa%e3%83%bc%e3%83%8b%e3%83%b3%e3%82%b0%e3%81%af%e7%97%9b%e3%81%84%e3%81%a7%e3%81%99%e3%81%8b%ef%bc%9f/,200,歯のクリーニングは痛いですか？ 岡山なかの歯科・矯正歯科クリニック歯の知恵袋Q&A,岡山なかの歯科・矯正歯科クリニック,,正常,C26_自費メンテナンス・予防,0.4002,維持・部分更新,
nakanodent.com,https://nakanodent.com/faq-portal/2025/11/24/%e8%a6%aa%e7%9f%a5%e3%82%89%e3%81%9a%e3%81%ae%e6%8a%9c%e6%ad%af%e5%be%8c%e3%81%ae%e6%b3%a8%e6%84%8f%e7%82%b9%e3%81%af%e4%bd%95%e3%81%a7%e3%81%99%e3%81%8b%ef%bc%9f/,200,親知らずの抜歯後の注意点は何ですか？ 岡山なかの歯科・矯正歯科クリニック歯の知恵袋Q&A,岡山なかの歯科・矯正歯科クリニック,,正常,C30_口腔外科・親知らず,0.3825,維持・部分更新,
nakanodent.com,https://nakanodent.com/faq-portal/2025/11/24/%e3%82%80%e3%81%97%e6%ad%af%e3%81%8c%e3%81%aa%e3%81%8f%e3%81%a6%e3%82%82%e6%ad%af%e5%8c%bb%e8%80%85%e3%81%ab%e8%a1%8c%e3%81%8f%e3%81%b9%e3%81%8d%e3%81%a7%e3%81%99%e3%81%8b%ef%bc%9f/,200,むし歯がなくても歯医者に行くべきですか？ 岡山なかの歯科・矯正歯科クリニック歯の知恵袋Q&A,岡山なかの歯科・矯正歯科クリニック,,正常,C40_地域・アクセス・診療時間,0.175,維持・部分更新,
nakanodent.com,https://nakanodent.com/faq-portal/2025/11/24/%e5%ad%90%e4%be%9b%e3%81%ae%e6%ad%af%e7%a3%a8%e3%81%8d%e3%81%af%e3%81%84%e3%81%a4%e3%81%8b%e3%82%89%e5%a7%8b%e3%82%81%e3%82%8b%e3%81%b9%e3%81%8d%e3%81%a7%e3%81%99%e3%81%8b%ef%bc%9f/,200,子供の歯磨きはいつから始めるべきですか？ 岡山なかの歯科・矯正歯科クリニック歯の知恵袋Q&A,岡山なかの歯科・矯正歯科クリニック,,正常,C12_小児矯正・基礎と適齢期,0.251,維持・部分更新,
nakanodent.com,https://nakanodent.com/faq-portal/2025/11/24/%e7%be%a9%e6%ad%af%ef%bc%88%e5%85%a5%e3%82%8c%e6%ad%af%ef%bc%89%e3%81%ae%e3%81%8a%e6%89%8b%e5%85%a5%e3%82%8c%e6%96%b9%e6%b3%95%e3%82%92%e6%95%99%e3%81%88%e3%81%a6%e3%81%8f%e3%81%a0%e3%81%95%e3%81%84/,200,義歯（入れ歯）のお手入れ方法を教えてください 岡山なかの歯科・矯正歯科クリニック歯の知恵袋Q&A,岡山なかの歯科・矯正歯科クリニック,,正常,C24_自費入れ歯・義歯,0.2465,維持・部分更新,
nakanodent.com,https://nakanodent.com/faq-portal/2025/11/24/%e6%ad%af%e5%8c%bb%e8%80%85%e3%81%a7%e3%81%a7%e3%81%8d%e3%82%8b%e3%83%9b%e3%83%af%e3%82%a4%e3%83%88%e3%83%8b%e3%83%b3%e3%82%b0%e3%81%ae%e7%a8%ae%e9%a1%9e%e3%81%a8%e9%81%95%e3%81%84%e3%81%af%e4%bd%95/,200,歯医者でできるホワイトニングの種類と違いは何ですか？ 岡山なかの歯科・矯正歯科クリニック歯の知恵袋Q&A,岡山なかの歯科・矯正歯科クリニック,,正常,C19_ホワイトニング・基礎と方式,0.4467,維持・部分更新,
nakanodent.com,https://nakanodent.com/faq-portal/2025/11/24/%e3%83%9b%e3%83%af%e3%82%a4%e3%83%88%e3%83%8b%e3%83%b3%e3%82%b0%e4%b8%ad%e3%81%ab%e7%9f%a5%e8%a6%9a%e9%81%8e%e6%95%8f%e3%81%8c%e8%b5%b7%e3%81%8d%e3%81%9f%e5%a0%b4%e5%90%88%e3%81%af%e3%81%a9%e3%81%86/,200,ホワイトニング中に知覚過敏が起きた場合はどうすればいいですか？ 岡山なかの歯科・矯正歯科クリニック歯の知恵袋Q&A,岡山なかの歯科・矯正歯科クリニック,,正常,C19_ホワイトニング・基礎と方式,0.4312,維持・部分更新,
nakanodent.com,https://nakanodent.com/faq-portal/2025/11/24/%e3%83%9b%e3%83%af%e3%82%a4%e3%83%88%e3%83%8b%e3%83%b3%e3%82%b0%e3%81%ab%e3%81%af%e3%81%a9%e3%81%ae%e3%82%88%e3%81%86%e3%81%aa%e7%a8%ae%e9%a1%9e%e3%81%8c%e3%81%82%e3%82%8a%e3%81%be%e3%81%99%e3%81%8b/,200,ホワイトニングにはどのような種類がありますか？ 岡山なかの歯科・矯正歯科クリニック歯の知恵袋Q&A,岡山なかの歯科・矯正歯科クリニック,,正常,C19_ホワイトニング・基礎と方式,0.4484,維持・部分更新,
nakanodent.com,https://nakanodent.com/faq-portal/2025/11/24/%e6%ad%af%e5%91%a8%e7%97%85%e3%81%af%e5%ae%8c%e6%b2%bb%e3%81%97%e3%81%be%e3%81%99%e3%81%8b%ef%bc%9f/,200,歯周病は完治しますか？ 岡山なかの歯科・矯正歯科クリニック歯の知恵袋Q&A,岡山なかの歯科・矯正歯科クリニック,,正常,C28_歯周病治療と再生療法,0.2478,維持・部分更新,
nakanodent.com,https://nakanodent.com/faq-portal/2025/11/24/%e6%ad%af%e3%82%92%e5%89%8a%e3%82%89%e3%81%aa%e3%81%84%e8%99%ab%e6%ad%af%e6%b2%bb%e7%99%82%e3%81%af%e3%81%82%e3%82%8b%e3%81%ae%e3%81%a7%e3%81%99%e3%81%8b%ef%bc%9f/,200,歯を削らない虫歯治療はあるのですか？ 岡山なかの歯科・矯正歯科クリニック歯の知恵袋Q&A,岡山なかの歯科・矯正歯科クリニック,,正常,C27_一般歯科・虫歯と痛み,0.4029,維持・部分更新,
nakanodent.com,https://nakanodent.com/faq-portal/2025/11/24/%e7%9f%af%e6%ad%a3%e6%b2%bb%e7%99%82%e4%b8%ad%e3%81%ab%e7%b5%90%e5%a9%9a%e5%bc%8f%e3%82%84%e6%97%85%e8%a1%8c%e3%81%ae%e4%ba%88%e5%ae%9a%e3%81%8c%e3%81%82%e3%82%8b%e5%a0%b4%e5%90%88%e3%80%81%e3%81%a9/,200,矯正治療中に結婚式や旅行の予定がある場合、どうすればいいですか？ 岡山なかの歯科・矯正歯科クリニック歯の知恵袋Q&A,岡山なかの歯科・矯正歯科クリニック,,正常,C43_AI検索特化・会話型クエリ,0.187,維持・部分更新,
nakanodent.com,https://nakanodent.com/faq-portal/2025/11/24/%e7%b5%90%e5%a9%9a%e5%bc%8f%e5%89%8d%e3%81%ab%e3%83%9b%e3%83%af%e3%82%a4%e3%83%88%e3%83%8b%e3%83%b3%e3%82%b0%e3%82%92%e5%8f%97%e3%81%91%e3%81%9f%e3%81%84%e3%81%ae%e3%81%a7%e3%81%99%e3%81%8c%e3%80%81/,200,結婚式前にホワイトニングを受けたいのですが、差し歯があっても可能ですか？ 岡山なかの歯科・矯正歯科クリニック歯の知恵袋Q&A,岡山なかの歯科・矯正歯科クリニック,,正常,C19_ホワイトニング・基礎と方式,0.4312,維持・部分更新,
nakanodent.com,https://nakanodent.com/faq-portal/2025/11/24/%e3%82%bb%e3%83%a9%e3%83%9f%e3%83%83%e3%82%af%e3%81%ae%e8%a9%b0%e3%82%81%e7%89%a9%ef%bc%88%e3%82%a4%e3%83%b3%e3%83%ac%e3%83%bc%ef%bc%89%e3%81%a8%e8%a2%ab%e3%81%9b%e7%89%a9%ef%bc%88%e3%82%af%e3%83%a9/,200,セラミックの詰め物（インレー）と被せ物（クラウン）の違いは何ですか？ 岡山なかの歯科・矯正歯科クリニック歯の知恵袋Q&A,岡山なかの歯科・矯正歯科クリニック,,正常,C21_セラミック治療・基礎と適応,0.4127,維持・部分更新,
nakanodent.com,https://nakanodent.com/faq-portal/2025/11/24/%e3%82%a4%e3%83%b3%e3%83%97%e3%83%a9%e3%83%b3%e3%83%88%e6%b2%bb%e7%99%82%e3%81%a7%e9%aa%a8%e3%81%8c%e8%b6%b3%e3%82%8a%e3%81%aa%e3%81%84%e5%a0%b4%e5%90%88%e3%81%af%e3%81%a9%e3%81%86%e3%81%aa%e3%82%8a/,200,インプラント治療で骨が足りない場合はどうなりますか？ 岡山なかの歯科・矯正歯科クリニック歯の知恵袋Q&A,岡山なかの歯科・矯正歯科クリニック,,正常,C07_インプラント・基礎理解,0.4224,維持・部分更新,
nakanodent.com,https://nakanodent.com/faq-portal/2025/11/24/pmtc%e3%81%a8%e3%81%af%e4%bd%95%e3%81%a7%e3%81%99%e3%81%8b%ef%bc%9f%e3%81%a9%e3%81%ae%e3%82%88%e3%81%86%e3%81%aa%e5%8a%b9%e6%9e%9c%e3%81%8c%e3%81%82%e3%82%8a%e3%81%be%e3%81%99%e3%81%8b%ef%bc%9f/,200,PMTCとは何ですか？どのような効果がありますか？ 岡山なかの歯科・矯正歯科クリニック歯の知恵袋Q&A,岡山なかの歯科・矯正歯科クリニック,,正常,C26_自費メンテナンス・予防,0.4752,維持・部分更新,
nakanodent.com,https://nakanodent.com/faq-portal/2025/11/24/%e5%ae%9a%e6%9c%9f%e7%9a%84%e3%81%aa%e6%ad%af%e3%81%ae%e3%83%a1%e3%83%b3%e3%83%86%e3%83%8a%e3%83%b3%e3%82%b9%e3%81%af%e3%81%aa%e3%81%9c%e5%bf%85%e8%a6%81%e3%81%a7%e3%81%99%e3%81%8b%ef%bc%9f/,200,定期的な歯のメンテナンスはなぜ必要ですか？ 岡山なかの歯科・矯正歯科クリニック歯の知恵袋Q&A,岡山なかの歯科・矯正歯科クリニック,,正常,C26_自費メンテナンス・予防,0.1952,維持・部分更新,
nakanodent.com,https://nakanodent.com/faq-portal/2025/11/24/%e3%83%9b%e3%83%af%e3%82%a4%e3%83%88%e3%83%8b%e3%83%b3%e3%82%b0%e3%81%ae%e5%8a%b9%e6%9e%9c%e3%81%af%e3%81%a9%e3%81%ae%e3%81%8f%e3%82%89%e3%81%84%e6%8c%81%e7%b6%9a%e3%81%97%e3%81%be%e3%81%99%e3%81%8b/,200,ホワイトニングの効果はどのくらい持続しますか？ 岡山なかの歯科・矯正歯科クリニック歯の知恵袋Q&A,岡山なかの歯科・矯正歯科クリニック,,正常,C19_ホワイトニング・基礎と方式,0.4476,維持・部分更新,
nakanodent.com,https://nakanodent.com/faq-portal/2025/11/24/%e5%96%ab%e7%85%99%e3%81%af%e6%ad%af%e3%82%84%e5%8f%a3%e8%85%94%e5%86%85%e3%81%ab%e3%81%a9%e3%81%ae%e3%82%88%e3%81%86%e3%81%aa%e5%bd%b1%e9%9f%bf%e3%81%8c%e3%81%82%e3%82%8a%e3%81%be%e3%81%99%e3%81%8b/,200,喫煙は歯や口腔内にどのような影響がありますか？ 岡山なかの歯科・矯正歯科クリニック歯の知恵袋Q&A,岡山なかの歯科・矯正歯科クリニック,,正常,C40_地域・アクセス・診療時間,0.1747,維持・部分更新,
nakanodent.com,https://nakanodent.com/faq-portal/2025/11/24/%e5%b0%8f%e5%85%90%e3%81%ae%e8%99%ab%e6%ad%af%e4%ba%88%e9%98%b2%e3%81%ab%e3%81%af%e3%81%a9%e3%81%ae%e3%82%88%e3%81%86%e3%81%aa%e6%96%b9%e6%b3%95%e3%81%8c%e3%81%82%e3%82%8a%e3%81%be%e3%81%99%e3%81%8b/,200,小児の虫歯予防にはどのような方法がありますか？ 岡山なかの歯科・矯正歯科クリニック歯の知恵袋Q&A,岡山なかの歯科・矯正歯科クリニック,,正常,C27_一般歯科・虫歯と痛み,0.3431,維持・部分更新,
nakanodent.com,https://nakanodent.com/faq-portal/2025/11/24/3mix%e6%b2%bb%e7%99%82%e3%81%a8%e3%81%af%e4%bd%95%e3%81%a7%e3%81%99%e3%81%8b%ef%bc%9f/,200,3Mix治療とは何ですか？ 岡山なかの歯科・矯正歯科クリニック歯の知恵袋Q&A,岡山なかの歯科・矯正歯科クリニック,,正常,C17_ワイヤー矯正・舌側・部分・外科矯正,0.2069,維持・部分更新,
nakanodent.com,https://nakanodent.com/faq-portal/2025/11/24/%e5%af%a9%e7%be%8e%e6%ad%af%e7%a7%91%e6%b2%bb%e7%99%82%e3%81%a8%e3%81%af%e3%81%a9%e3%81%ae%e3%82%88%e3%81%86%e3%81%aa%e3%82%82%e3%81%ae%e3%81%a7%e3%81%99%e3%81%8b%ef%bc%9f/,200,審美歯科治療とはどのようなものですか？ 岡山なかの歯科・矯正歯科クリニック歯の知恵袋Q&A,岡山なかの歯科・矯正歯科クリニック,,正常,C32_訪問歯科・高齢者歯科,0.2283,維持・部分更新,
nakanodent.com,https://nakanodent.com/faq-portal/2025/11/24/%e6%ad%af%e7%a7%91%e7%94%a8%e3%83%ac%e3%83%bc%e3%82%b6%e3%83%bc%e3%81%a8%e3%81%af%e3%81%a9%e3%81%ae%e3%82%88%e3%81%86%e3%81%aa%e3%82%82%e3%81%ae%e3%81%a7%e3%81%99%e3%81%8b%ef%bc%9f/,200,歯科用レーザーとはどのようなものですか？ 岡山なかの歯科・矯正歯科クリニック歯の知恵袋Q&A,岡山なかの歯科・矯正歯科クリニック,,正常,C17_ワイヤー矯正・舌側・部分・外科矯正,0.2063,維持・部分更新,
nakanodent.com,https://nakanodent.com/faq-portal/2025/11/24/%e3%82%a4%e3%83%b3%e3%83%97%e3%83%a9%e3%83%b3%e3%83%88%e6%b2%bb%e7%99%82%e3%81%ae%e3%83%a1%e3%83%aa%e3%83%83%e3%83%88%e3%81%af%e4%bd%95%e3%81%a7%e3%81%99%e3%81%8b%ef%bc%9f/,200,インプラント治療のメリットは何ですか？ 岡山なかの歯科・矯正歯科クリニック歯の知恵袋Q&A,岡山なかの歯科・矯正歯科クリニック,,正常,C07_インプラント・基礎理解,0.4451,維持・部分更新,
nakanodent.com,https://nakanodent.com/faq-portal/2025/11/24/%e6%ad%af%e3%81%ae%e3%83%9b%e3%83%af%e3%82%a4%e3%83%88%e3%83%8b%e3%83%b3%e3%82%b0%e3%81%ab%e3%81%a4%e3%81%84%e3%81%a6%e7%9b%b8%e8%ab%87%e3%81%97%e3%81%9f%e3%81%84%e3%81%ae%e3%81%a7%e3%81%99%e3%81%8c/,200,歯のホワイトニングについて相談したいのですが、なかの歯科クリニックにはどのようなシステムがありますか？ 岡山なかの歯科・矯正歯科クリニック歯の知恵袋Q&A,岡山なかの歯科・矯正歯科クリニック,,正常,C19_ホワイトニング・基礎と方式,0.4454,維持・部分更新,
nakanodent.com,https://nakanodent.com/faq-portal/2025/11/24/%e3%83%86%e3%83%88%e3%83%a9%e3%82%b5%e3%82%a4%e3%82%af%e3%83%aa%e3%83%b3%e6%ad%af%e3%81%ae%e5%a4%89%e8%89%b2%e3%81%af%e6%b2%bb%e3%82%8a%e3%81%be%e3%81%99%e3%81%8b%ef%bc%9f/,200,テトラサイクリン歯の変色は治りますか？ 岡山なかの歯科・矯正歯科クリニック歯の知恵袋Q&A,岡山なかの歯科・矯正歯科クリニック,,正常,C40_地域・アクセス・診療時間,0.1752,維持・部分更新,
nakanodent.com,https://nakanodent.com/faq-portal/2025/11/24/%e3%82%ad%e3%83%a3%e3%83%aa%e3%82%bd%e3%83%ab%e3%83%96%e3%81%a8%e3%81%af%e3%81%a9%e3%81%ae%e3%82%88%e3%81%86%e3%81%aa%e6%b2%bb%e7%99%82%e6%b3%95%e3%81%a7%e3%81%99%e3%81%8b%ef%bc%9f/,200,キャリソルブとはどのような治療法ですか？ 岡山なかの歯科・矯正歯科クリニック歯の知恵袋Q&A,岡山なかの歯科・矯正歯科クリニック,,正常,C17_ワイヤー矯正・舌側・部分・外科矯正,0.206,維持・部分更新,
nakanodent.com,https://nakanodent.com/faq-portal/2025/11/24/cr%e5%85%85%e5%a1%ab%ef%bc%88%e3%82%b3%e3%83%b3%e3%83%9d%e3%82%b8%e3%83%83%e3%83%88%e3%83%ac%e3%82%b8%e3%83%b3%e5%85%85%e5%a1%ab%ef%bc%89%e3%81%a8%e3%81%af%e4%bd%95%e3%81%a7%e3%81%99%e3%81%8b%ef%bc%9f/,200,CR充填（コンポジットレジン充填）とは何ですか？ 岡山なかの歯科・矯正歯科クリニック歯の知恵袋Q&A,岡山なかの歯科・矯正歯科クリニック,,正常,C17_ワイヤー矯正・舌側・部分・外科矯正,0.2061,維持・部分更新,
nakanodent.com,https://nakanodent.com/faq-portal/2025/11/24/%e3%81%bf%e3%81%8c%e3%82%ad%e3%83%83%e3%82%ba%e2%98%86%e3%82%af%e3%83%a9%e3%83%96%e3%81%a8%e3%81%af%e4%bd%95%e3%81%a7%e3%81%99%e3%81%8b%ef%bc%9f/,200,みがキッズ☆クラブとは何ですか？ 岡山なかの歯科・矯正歯科クリニック歯の知恵袋Q&A,岡山なかの歯科・矯正歯科クリニック,,正常,C17_ワイヤー矯正・舌側・部分・外科矯正,0.2064,維持・部分更新,
nakanodent.com,https://nakanodent.com/faq-portal/2025/11/24/%e3%81%aa%e3%81%8b%e3%81%ae%e6%ad%af%e7%a7%91%e3%82%af%e3%83%aa%e3%83%8b%e3%83%83%e3%82%af%e3%81%a7%e3%81%af%e3%80%81%e3%81%a9%e3%81%ae%e3%82%88%e3%81%86%e3%81%aa%e3%83%9f%e3%83%bc%e3%83%86%e3%82%a3/,200,なかの歯科クリニックでは、どのようなミーティングを行っていますか？ 岡山なかの歯科・矯正歯科クリニック歯の知恵袋Q&A,岡山なかの歯科・矯正歯科クリニック,,正常,C26_自費メンテナンス・予防,0.1927,維持・部分更新,
nakanodent.com,https://nakanodent.com/faq-portal/2025/11/24/%e4%bb%ae%e6%ad%af%e3%81%ae%e4%bd%9c%e8%a3%bd%e3%81%af%e3%81%a9%e3%81%ae%e3%82%88%e3%81%86%e3%81%ab%e8%a1%8c%e3%81%84%e3%81%be%e3%81%99%e3%81%8b%ef%bc%9f/,200,仮歯の作製はどのように行いますか？ 岡山なかの歯科・矯正歯科クリニック歯の知恵袋Q&A,岡山なかの歯科・矯正歯科クリニック,,正常,C40_地域・アクセス・診療時間,0.1754,維持・部分更新,
nakanodent.com,https://nakanodent.com/faq-portal/2025/11/24/%e3%81%aa%e3%81%8b%e3%81%ae%e6%ad%af%e7%a7%91%e3%82%af%e3%83%aa%e3%83%8b%e3%83%83%e3%82%af%e3%81%a7%e3%81%af%e6%ad%af%e7%a7%91%e5%8c%bb%e9%99%a2%e7%a0%94%e4%bf%ae%e6%97%85%e8%a1%8c%e3%82%92%e5%ae%9f/,200,なかの歯科クリニックでは歯科医院研修旅行を実施されているそうですが、その目的は何ですか？ 岡山なかの歯科・矯正歯科クリニック歯の知恵袋Q&A,岡山なかの歯科・矯正歯科クリニック,,正常,C40_地域・アクセス・診療時間,0.1874,維持・部分更新,
nakanodent.com,https://nakanodent.com/faq-portal/2025/11/24/%e6%ad%af%e3%81%ae%e3%82%a4%e3%83%b3%e3%83%97%e3%83%a9%e3%83%b3%e3%83%88%e6%b2%bb%e7%99%82%e3%81%ae%e3%83%a1%e3%83%aa%e3%83%83%e3%83%88%e3%81%af%e4%bd%95%e3%81%a7%e3%81%99%e3%81%8b%ef%bc%9f/,200,歯のインプラント治療のメリットは何ですか？ 岡山なかの歯科・矯正歯科クリニック歯の知恵袋Q&A,岡山なかの歯科・矯正歯科クリニック,,正常,C07_インプラント・基礎理解,0.4447,維持・部分更新,
nakanodent.com,https://nakanodent.com/faq-portal/2025/11/24/%e7%94%a3%e4%bc%91%e3%83%bb%e8%82%b2%e4%bc%91%e5%be%8c%e3%82%82%e6%ad%af%e7%a7%91%e8%a1%9b%e7%94%9f%e5%a3%ab%e3%81%a8%e3%81%97%e3%81%a6%e5%be%a9%e5%b8%b0%e3%81%a7%e3%81%8d%e3%81%be%e3%81%99%e3%81%8b/,200,産休・育休後も歯科衛生士として復帰できますか？ 岡山なかの歯科・矯正歯科クリニック歯の知恵袋Q&A,岡山なかの歯科・矯正歯科クリニック,,正常,C34_院長・医師プロフィール,0.2165,維持・部分更新,
